{
  "$schema": "http://json-schema.org/draft-07/schema#",
  "title": "phreaknic topics.json",
  "type": "array",
  "items": {
    "type": "object",
    "required": ["id", "title", "date", "time", "room", "speaker_ids"],
    "properties": {
      "id": {
        "type": "string",
        "minLength": 1
      },
      "title": {
        "type": "string",
        "minLength": 1
      },
      "date": {
        "type": "string",
        "pattern": "^\\d{4}-\\d{2}-\\d{2}$"
      },
      "time": {
        "type": "string",
        "pattern": "^\\d{2}:\\d{2}$"
      },
      "room": {
        "type": "string",
        "minLength": 1
      },
      "speaker_ids": {
        "type": "array",
        "items": {
          "type": "string",
          "minLength": 1
        }
      },
      "description": {
        "type": "string"
      }
    },
    "additionalProperties": false
  }
}
