[
  {
    "id": "doors-open",
    "title": "Doors Open & Registration",
    "date": "2026-11-06",
    "time": "09:00",
    "room": "Lobby",
    "speaker_ids": []
  },
  {
    "id": "keynote-death-trust",
    "title": "Keynote: The Death of Trust in Digital Systems",
    "date": "2026-11-06",
    "time": "10:00",
    "room": "Main Hall",
    "speaker_ids": ["cipher-raven"],
    "description": "A deep dive into the systemic vulnerabilities at the heart of every trust-based digital system we rely on — from PKI to zero-knowledge proofs. Raven walks through recent real-world collapses of digital trust and what it means for the future of encryption."
  },
  {
    "id": "reverse-engineering-protocols",
    "title": "Reverse Engineering Proprietary Protocols",
    "date": "2026-11-06",
    "time": "11:00",
    "room": "Room A",
    "speaker_ids": ["nullbyte"],
    "description": "Hands-on techniques for protocol recovery, including side-channel analysis, bus snooping, and fuzzing strategies that reveal hidden communication channels in supposedly closed-source hardware. Covers IoT gadgets, medical devices, and automotive ECUs."
  },
  {
    "id": "sdr-from-scratch",
    "title": "Building Your Own SDR from Scratch",
    "date": "2026-11-06",
    "time": "11:00",
    "room": "Room B",
    "speaker_ids": ["zero-cool"],
    "description": "A hands-on deep dive into the design, fabrication, and programming of custom SDR hardware. Learn about ADC/DAC selection, FPGA pipeline design, GNU Radio integration, and the art of squeezing maximum performance out of commodity silicon."
  },
  {
    "id": "lunch-day1",
    "title": "Lunch Break",
    "date": "2026-11-06",
    "time": "12:00",
    "room": "Cafeteria",
    "speaker_ids": []
  },
  {
    "id": "hardware-hacking-lab",
    "title": "Workshop: Hardware Hacking Lab",
    "date": "2026-11-06",
    "time": "13:30",
    "room": "Maker Space",
    "speaker_ids": []
  },
  {
    "id": "iot-security-firmware",
    "title": "IoT Security: From Firmware to Flame",
    "date": "2026-11-06",
    "time": "13:30",
    "room": "Room A",
    "speaker_ids": ["dark-signal"],
    "description": "Covers the full attack surface of IoT devices — from physical port enumeration and chip-off forensic extraction to dynamic malware analysis in emulated firmware environments. Discusses the growing threat of firmware supply chain attacks."
  },
  {
    "id": "osint-at-scale",
    "title": "OSINT at Scale: Mapping the Shadow Network",
    "date": "2026-11-06",
    "time": "15:00",
    "room": "Room A",
    "speaker_ids": []
  },
  {
    "id": "social-engineering-firewall",
    "title": "Social Engineering: The Human Firewall",
    "date": "2026-11-06",
    "time": "15:00",
    "room": "Room B",
    "speaker_ids": ["phantom-packet"],
    "description": "Covers the full spectrum of social engineering techniques, from pre-texting and pretext development to advanced impersonation strategies. Discusses the ethical boundaries of social engineering research and how to use these techniques defensively."
  },
  {
    "id": "panel-regulation-innovation",
    "title": "Panel: Regulation vs. Innovation in Security Research",
    "date": "2026-11-06",
    "time": "16:30",
    "room": "Main Hall",
    "speaker_ids": []
  },
  {
    "id": "rooftop-social",
    "title": "After Hours: Rooftop Social Engineering Range",
    "date": "2026-11-06",
    "time": "18:00",
    "room": "Rooftop",
    "speaker_ids": []
  },
  {
    "id": "keynote-ai-attacks",
    "title": "Keynote: AI-Powered Attacks and How to Defend",
    "date": "2026-11-07",
    "time": "10:00",
    "room": "Main Hall",
    "speaker_ids": ["neon-oracle"],
    "description": "Explores the dual-use nature of AI — how the same techniques that power breakthrough research can also be weaponized by adversaries. Walks through recent attack demonstrations, discusses the current state of AI defense research, and presents a roadmap for building AI systems that are secure by design."
  },
  {
    "id": "exploit-development-mitigations",
    "title": "Exploit Development: Bypassing Modern Mitigations",
    "date": "2026-11-07",
    "time": "11:00",
    "room": "Room A",
    "speaker_ids": ["binary-monk"],
    "description": "Walks through recent exploit chains that bypass modern mitigations, with deep dives into kernel exploitation techniques, user-space ROP, and the emerging role of AI-assisted vulnerability discovery. Covers ASLR, DEP, CFG, CET bypasses on Windows, Linux, and macOS."
  },
  {
    "id": "lora-exploitation",
    "title": "LoRa and Long-Range Wireless Exploitation",
    "date": "2026-11-07",
    "time": "11:00",
    "room": "Room B",
    "speaker_ids": ["spectrum-ghost"],
    "description": "Walks through real attack demonstrations on LoRa, Sigfox, and NB-IoT deployments — from jamming and replay attacks to full protocol exploitation. Discusses the emerging defenses being built into next-generation LPWAN stacks."
  },
  {
    "id": "lunch-day2",
    "title": "Lunch Break",
    "date": "2026-11-07",
    "time": "12:00",
    "room": "Cafeteria",
    "speaker_ids": []
  },
  {
    "id": "cryptography-workshop",
    "title": "Workshop: Cryptography in Practice",
    "date": "2026-11-07",
    "time": "13:30",
    "room": "Maker Space",
    "speaker_ids": []
  },
  {
    "id": "supply-chain-attacks",
    "title": "Supply Chain Attacks: When Your Tools Turn",
    "date": "2026-11-07",
    "time": "13:30",
    "room": "Room A",
    "speaker_ids": []
  },
  {
    "id": "steganography-plain-sight",
    "title": "Steganography: Hiding Data in Plain Sight",
    "date": "2026-11-07",
    "time": "15:00",
    "room": "Room B",
    "speaker_ids": ["echo-vector"],
    "description": "Covers the latest advances in steganographic techniques, from LSB embedding and DCT-based methods to deep learning-driven approaches. Demonstrates practical tools and walks through real-world use cases, including secure whistleblowing channels and covert data exfiltration."
  },
  {
    "id": "adversarial-ml",
    "title": "Adversarial Machine Learning Deep Dive",
    "date": "2026-11-07",
    "time": "15:00",
    "room": "Room A",
    "speaker_ids": []
  },
  {
    "id": "closing-keynote",
    "title": "Closing Keynote: The Hacker's Manifesto 2.0",
    "date": "2026-11-07",
    "time": "16:30",
    "room": "Main Hall",
    "speaker_ids": []
  },
  {
    "id": "closing-ceremony",
    "title": "Closing Ceremony & After Party",
    "date": "2026-11-07",
    "time": "18:00",
    "room": "Main Hall",
    "speaker_ids": []
  }
]
